{
  "version": "1.0",
  "slug": "korea-wind",
  "auditType": "cross_chapter_audit",
  "freezeId": "freeze-kor-old",
  "status": "passed",
  "criticalIssues": [],
  "highIssues": [
    {
      "issueId": "HIGH-001",
      "message": "Fixture high issue should block release."
    }
  ],
  "mediumIssues": [],
  "checkedChapterIds": [
    "0",
    "1",
    "2",
    "3",
    "4",
    "5",
    "6",
    "7",
    "8",
    "9",
    "10",
    "11",
    "12",
    "13",
    "14",
    "15",
    "16"
  ],
  "checkedMetricIds": [
    "KOR-OFFSHORE-NATIONAL-2024"
  ],
  "checkedProjectIds": [
    "KOR-EXPIRED-OEM-ACTIVE"
  ],
  "repairTasks": []
}
